link,title,,duration,audio_res,video_res
https://www.youtube.com/watch?v=PzxxEVdM1xI,Chapter 1: Introduction to the Animal Cell,introduction to animal cell,05:30,140,315
https://www.youtube.com/watch?v=s1NzeCxAp7w,Chapter 2: The Nucleus and the Endoplasmic Reticulum,nucleus and endoplaspic reticulum,06:18,140,315
https://www.youtube.com/watch?v=7RFjJCqtcG8,"Chapter 3: The Golgi Complex, Lysosomes, and the Plasma Membrane",golgi complex,05:31,140,315
https://www.youtube.com/watch?v=fDVnKTT8CZE,Chapter 4: The Mitochondria,mitochondria,03:42,140,315
https://www.youtube.com/watch?v=zCArzXX5jEM,Chapter 5: Overview of a Plant Cell,plant celll overview,03:24,140,315
https://www.youtube.com/watch?v=xoSWNLSnj1g,Chapter 6: Introduction to the DNA,intro to dna,04:03,140,315
https://www.youtube.com/watch?v=PmF4spLabbo,Chapter 7: RNA and Transcription,intro to rna,06:15,140,315
https://www.youtube.com/watch?v=qRUeM-IEdm8,Chapter 8: Translation (Protein Synthesis),protein synthesis,06:05,140,315
https://www.youtube.com/watch?v=rKS-vvhMV6E,360° Guided Tour of the Cell (demo),guided cell tour,01:13,140,313
https://www.youtube.com/watch?v=lfj6hhKjoQI,360° VR Bone Resorption,bone resorption,00:45,140,313
https://www.youtube.com/watch?v=6wPqBXva7-s,360° Scalp with Head Lice!,scalp with head lice,00:30,140,313
https://www.youtube.com/watch?v=s7FQbjzE_GU,360° Inside the Human Eye (demo),human eye,01:00,140,313
https://www.youtube.com/watch?v=IOK2fNXjDUU,360° Endocrine Cells Animation (demo),endocrine cell,00:40,140,313
https://www.youtube.com/watch?v=5ykGyb-Zt88,360° Tumor Death Animation (demo),tumor,01:10,140,313
https://www.youtube.com/watch?v=8VUCEbNNKzI,360° Cellular Activity Animation (demo),cellular activity,00:30,140,313
https://www.youtube.com/watch?v=bXZiUgZpt08,360° Blood Flow Animation (demo),blood flow,00:36,140,313
https://www.youtube.com/watch?v=pVA6vLCr0hI,Parallel Lines Might Meet at the End of the Universe | 360 VR,does parallel lines meet at the end of universe,08:23,140,315
https://www.youtube.com/watch?v=kw9EJbezlK4,WHAT HAPPENS INSIDE YOUR BODY? || 360 VR,what happens inside our body,08:07,140,313
https://www.youtube.com/watch?v=aogLFedcnTI,Intercellular – An Interbody VR Experience,intercellular experience,03:12,140,315
https://www.youtube.com/watch?v=BZy1XUTCiL4,Visit the Okavango Delta in 360° ,elephant safari,03:37,140,313
https://www.youtube.com/watch?v=EbUHKw8r5xA,Journey into the Deep Sea - VR | National Geographic,deep sea safari,09:00,140,313
https://www.youtube.com/watch?v=GvCFYjVFkk4,"How Coca-Cola gets made, in 360° - BBC London",coca cola factory,03:23,140,313
https://www.youtube.com/watch?v=9zTsDXMyBEY,The Body VR: Journey Inside a Cell - 360 Gameplay,journey inside human body,10:36,140,315
https://www.youtube.com/watch?v=U4AvQuL4UeY,Fertilization process - Virtual Reality 3D 360° video,human fertilization process,03:19,140,313
https://www.youtube.com/watch?v=0A56uOVluNM,Cellscape VR Biology Guided Tour Animation,cell guided tour,06:36,140,313
https://www.youtube.com/watch?v=rmgf0VDDlH8,"Virtual Plant Cell: Cell Explore, 2018. VPC 360° video by Plant Energy Biology",how plants manke chlorophyl,05:58,140,313
https://www.youtube.com/watch?v=kL9YU_ZzGF4,Zika Virus 3D VR. Virtual Reality Animation,zika virus,02:27,140,313
https://www.youtube.com/watch?v=sKVxN711hCA,360° Explore Our Solar System in VR,solar system complete,08:11,140,313
https://www.youtube.com/watch?v=ueBJZbiquok,TO THE EARTH'S CORE 360° - VR Video,journey to earth core,03:08,140,313
https://www.youtube.com/watch?v=YbD4O_MQJ1U,Sun and Black Hole - 360,collision of sun and black hole,01:00,140,313
https://www.youtube.com/watch?v=7WMmAuYsInY,360° Universe Size Comparison | 3D Virtual Reality Experience,size comparisions of various starts,02:56,140,315
https://www.youtube.com/watch?v=-dAMKyvpHag,Earth's GIANT Core Magnet? | 360 | VR |,earths magnetic field,01:50,140,313
https://www.youtube.com/watch?v=LrJf6fj-Kag,FALL or FLOAT Gravity Decides what Happens When you Jump | Gravity and Air Resistance | 360 | VR |,earth gravity and resistance,02:40,140,313
https://www.youtube.com/watch?v=caz5odFo6vw,The Water Cycle | 360 | VR |,water cycle,03:00,140,313
https://www.youtube.com/watch?v=WXAHh3pe84k,What Climate Change Will Look Like on Earth | 360 | VR |,climate change on earth,03:10,140,313
https://www.youtube.com/watch?v=XoGdm1puMyM,Experience a Tsunami and the Destruction it can Bring | 360 | VR |!!,tsunami and its destruction,04:10,140,313
https://www.youtube.com/watch?v=2TUsOn53ubc,The Four Seasons in VR!! Spring / Summer / Autumn / Winter,fours seasons on earth,01:37,140,313
https://www.youtube.com/watch?v=5B8S79wsGrw,Is SpaceX Starship Small Compared with ISS? - 360 VR!,spaceships comparision,01:32,140,313
https://www.youtube.com/watch?v=57R0AvC9lYI,What are the Lunar Phases of the Moon? | 360 | VR |,lunar cycle,01:32,140,313
https://www.youtube.com/watch?v=v3YTUqKeUTY,"Will Our Sun Explode in a 25,000 mph Supernovae Blast? | 360 | VR |",sun explosion,01:32,140,313
https://www.youtube.com/watch?v=IS6gBykMeN8,Mercury's the Smallest Planet but has the Largest Temperature Fluctuations | 360 | VR |,about mercury,02:24,140,313
https://www.youtube.com/watch?v=S5z0TGLv4Bk,"The Surface of Venus - The Hot, Hellish and Volcanic Planet! | 360 | VR |",about venus,02:20,140,313
https://www.youtube.com/watch?v=giP0KQs8PFg,The Only Known Planet to Support Life - Earth | 360 | VR |,about earth,02:24,140,313
https://www.youtube.com/watch?v=GABY8hZskrI,Visit the Mars Curiosity Rover on the Martian Surface | 360 | VR |,about mars,02:50,140,313
https://www.youtube.com/watch?v=aglWkFjXRGE,What Jupiter Looks Like Inside | 360 | VR |,about jupiter,01:45,140,313
https://www.youtube.com/watch?v=i82HxS21OwA,Saturn - The Jewel of the Solar System | 360 | VR |,about saturn,02:07,140,313
https://www.youtube.com/watch?v=JpynjTfHETk,Uranus the Ice Giant of the Solar System! | 360 | VR |,about uranus,01:32,140,313
https://www.youtube.com/watch?v=2mg7a4ahXtA,"Dark, Cold and Very Windy - Neptune's Hostile Environment | 360 | VR |",about neptune,01:55,140,313
https://www.youtube.com/watch?v=96-J3JZ0jVE,360 Video Walk on Pluto's Surface - The Most Distant Planet,about pluto,01:45,140,313
https://www.youtube.com/watch?v=ps3vt5iM6JA,Solar System - Step onto Every Planet's Surface,environment on each planet of solar system,10:15,140,313
https://www.youtube.com/watch?v=GgXtU-rpzYM,Best of Wild Animals in VR 2021 | Wildlife in 360 VR,wild animals,05:22,140,313
https://www.youtube.com/watch?v=YgOt1n-ZYc0,New Seven Wonders of The World: The Colosseum | 360 Video,the colosseum wonder,01:19,140,313
https://www.youtube.com/watch?v=2tMbosos1QQ,New Seven Wonders of The World: Christ the Redeemer | 360 Video,christ redeemer wonder,01:05,140,313
https://www.youtube.com/watch?v=I3W1kyp9Jpc,Seven Wonders of the World: Petra | 360 Video,petra wonder,01:09,140,313
https://www.youtube.com/watch?v=WrqDajfC4Ms,Seven Wonders of The World: The Great Wall | 360 Video,the great wall wonder,01:16,140,313
https://www.youtube.com/watch?v=p2NF8ZR28KI,New Seven Wonders in 360: Machu Picchu,machu picchu wonder,00:57,140,313
https://www.youtube.com/watch?v=B9eFlqPgBO0,Seven Wonders of the World: Chichén Itzá  | 360 Video,chicha wonder,00:57,140,313
https://www.youtube.com/watch?v=Q-Ur4aAlB64,New Seven Wonders in 360: Taj Mahal,taj mahal wonder,01:07,140,313
https://www.youtube.com/watch?v=CPmMfasVxbY,Inside the Making of an Intel Chip – 360 Fab Tour for VR,intel chip manufacturing,07:52,140,313
https://www.youtube.com/watch?v=9GjAcbv0MBU,"VR 360 Diving 🐟 Whale, Jellyfish & Turtles","swim with whales ,jellyfist and turtles",09:42,140,313
https://www.youtube.com/watch?v=ZO9sDT-3ljw,Sharks feeding. Bahamas. Underwater 360 video in 12K,feed the sharks,03:43,140,313
https://www.youtube.com/watch?v=u1Yyfhqcf5w,A Very Brief History of The Universe (Virtual Reality),brief history of universe,03:52,140,315
https://www.youtube.com/watch?v=FwLppp6sVUI,Hyenas on the Prowl - Murchison Falls - Official Teaser #2 (8K 3D 360 VR Video),1:1,140,313
https://www.youtube.com/watch?v=4xkUIegJ2BU,Meet The Mountain Gorillas - 360 VR Video - Short Version,1:33,140,313
https://www.youtube.com/watch?v=xal78egELos,The Eye Of The Tiger VR Experience - 360 Video,1:40,140,313
https://www.youtube.com/watch?v=TOfP7dl2ow4,Giant Aldabra Tortoises - 360 VR Video,1:9,140,313
https://www.youtube.com/watch?v=NRw7A8CblIs,Meet The African Penguins - 360 VR Video,0:56,140,313
https://www.youtube.com/watch?v=okZPF-1jSy8,Meet The Meerkats - 360 VR Video,1:16,140,313
https://www.youtube.com/watch?v=-NLTCIAJyvc,Meet the Coypu - 360 VR Video,0:53,140,313
https://www.youtube.com/watch?v=osX-JP0ZL6g,Komodo Dragons On Rinca Island - 360 VR Video,1:1,140,313
